Unicorn Farts,A wonderful bag of fresh unicorn farts,$9.99,99,,FALSE
Lucky Unicorn Shoe,A gift of magical luck for your special somone. ,$34.99,50,,FALSE
Unicorn Fun Mug,Your morning coffee will be extra special with a little Unicorn humor,$14.99,80,,FALSE
You Are My Unicorn,Let your loved one know how special they are with this sweet charm.,$15.99,20,,FALSE
Unicorn Ate My Homeword Tee,Everyone needs magical excuses in life,$19.99,40,,FALSE
Unicorn Bedspread,Add a little magic to your dreams,$69.99,30,,FALSE
Eat Cake Like a Unicorn,Fun magical Tee,$19.99,45,,FALSE
Magical Chair,Unicorn chair for the your inner princess,$74.99,15,,FALSE
Unicorn Flats,Magic for the comfy cute days,$34.99,56,,FALSE
Unicorn Horn Neclace,Always be a Unicorn with this magical charm,$24.99,10,,FALSE
Unicorn Light-up Slippers,Magical comfy's for your feet,$24.99,100,,FALSE
"""Always be a Unicorn"" Wall art",Bring a little magic into your home with this upcycled wall art. ,$22.99,30,,FALSE
Unicorn Pillow,To make your dreams a little sweeter,$14.99,30,,FALSE
Unicorn Pillow,To make your dreams a little sweeter,$14.99,30,,FALSE
Unicorn Platforms,Magical shoes for your inner party girl,$56.99,40,,FALSE
Unicorn ring,For all the unicorn lovers on your gift list,$18.99,20,,FALSE
Unicorn Steampunk Neclase,Handmade steampunk unicorn design,$24.99,20,,FALSE
Purple Unicorn Wall Art,Handprinted Unicorn art,$18.99,15,,FALSE
Unicorn Wall Mount,A must have for every Unicorn Believer,$64.99,25,,FALSE
Sparkly Poo,One dozen tasty treats for any occation ,$9.99,15,,FALSE
Magical Horn Cookies,One dozen tasty treats for any occation ,$12.99,15,,FALSE
Gin of Tears,The magical way to forget all your sorrows,$99.99,10,,FALSE